ID товара,Наименование товара,Ссылка на товар,Регулярная цена,Старая цена
1051424,"Brit Premium пауч для взрослых стерилизованных кошек перепелка в желе, 85 гр",/product/brit-premium-pauch-dlya-vzroslyh-sterilizovannyh-koshek-perepelka-v-zhele-85-gr-88958-1051424/,73 ₽,Нет старой цены
1053915,"UNICA Outdoor сухой корм для кошек с уткой, рисом и апельсинами, 350 гр",/product/unica-outdoor-suhoj-korm-dlya-koshek-s-utkoj-risom-i-apelsinami-350-gr-1251-1053915/,519 ₽,Нет старой цены
1044815,"Ownat Adult Grain Free Сухой корм для взрослых кошек, с курицей и индейкой, 1 кг",/product/ownat-adult-grain-free-suhoj-korm-dlya-vzroslyh-koshek-s-kuritsej-i-indejkoj-1-kg-1186-1044815/,1 599 ₽,Нет старой цены
1003946,"ProPlan Sterilised Adult Renal Plus Сухой корм для поддержания здоровья почек у стерилизованных кошек, с кроликом, 400 гр.",/product/proplan-sterilised-suhoj-korm-dlya-vzroslyh-koshek-dlya-podderzhaniya-zdorovya-pochek-posle-sterilizatsii-s-krolikom-400-g-85063-1003946/,533 ₽,Нет старой цены
1052572,"Gourmet Влажный корм (пауч) для взрослых кошек Перл Нежное филе, с курицей в соусе, 75 гр.",/product/gourmet-korm-vlazhnyj-dlya-koshek-kusochki-kuritsy-v-souse-75-g-517-1052572/,32 ₽,42 ₽
1054941,"Yummy Влажный корм (консервы) для кошек, мусс сливочный с говядиной, 100 гр.",/product/konservirovannyj-slivochnyj-muss-dlya-koshek-s-govyadinoj-100-gr-89076-1054941/,95 ₽,Нет старой цены
1000714,"Royal Canin Sensible 33 Regular Сухой корм при чувствительной пищеварительной системе у кошек в возрасте от 1 года до 7 лет, 2 кг",/product/royal-canin-sensible-33-suhoj-korm-dlya-koshek-s-chuvstvitelnoj-pishchevaritelnoj-sistemoj-v-vozraste-s-1-goda-do-7-let-2-kg-1010-1000714/,2 399 ₽,Нет старой цены
1043393,"Felix Sensations Влажный корм (пауч) для взрослых кошек Супервкус, с индейкой и ягодами в желе, 75 гр.",/product/felix-sensations-supervkus-vlazhnyj-korm-dlya-vzroslyh-koshek-s-indejkoj-i-yagodami-v-zhele-75-g-657-1043393/,30 ₽,33 ₽
1054895,"Felix Влажный корм (пауч) для котят Аппетитные кусочки, с курицей в желе, 75 гр.",/product/felix-appetitnye-kusochki-korm-vlazhnyj-dlya-kotyat-s-kuritsej-75g-88995-1054895/,30 ₽,33 ₽
1060938,"KLICKER Adult Cat Food Сухой корм для кошек, с ягненком, 0,3 кг",/product/suhoj-korm-dlya-koshek-s-yagnenkom-0-3kg-86228-1060938/,649 ₽,Нет старой цены
1054673,"Четвероногий Гурман Golden Line Влажный корм (консервы) для кошек и котят, мусс с телятиной, 100 гр.",/product/chetveronogij-gurman-konservy-dlya-koshek-s-telyatinoj-89102-1054673/,165 ₽,Нет старой цены
1059502,"Brit Корм сухой для стерилизованных кошек, с индейкой и уткой, 1,5 кг",/product/brit-korm-suhoj-dlya-sterilizovannyh-koshek-s-indejkoj-i-utkoj-1-5kg-83132-1059502/,1 939 ₽,Нет старой цены
1016799,"Perfect Fit Сухой корм для стерилизованных кошек, с курицей, 1,2 кг",/product/perfect-fit-korm-suhoj-dlya-sterilizovannyh-koshek-s-kuritsej-1-2-kg-86375-1016799/,765 ₽,Нет старой цены
1054908,"Felix Влажный корм (пауч) для взрослых кошек Природа вкуса, с лососем в соусе, 75 гр.",/product/felix-priroda-vkusa-korm-vlazhnyj-dlya-koshek-losos-75g-88991-1054908/,22 ₽,27 ₽
1061159,"NATURE`S TABLE Сухой корм для кошек, со вкусом курицы, 650 гр.",/product/nature-s-table-suhoj-korm-dlya-koshek-kuritsa-650g-86613-1061159/,388 ₽,553 ₽
1053757,"Sirius Корм сухой для стерилизованных кошек, с индейкой и курицей, 1,5 кг",/product/sirius-korm-suhoj-dlya-sterilizovannyh-koshek-s-indejkoj-i-kuritsej-1-5-kg-1243-1053757/,1 159 ₽,Нет старой цены
1038958,"Gourmet Влажный корм (пауч) для взрослых кошек Желе Де-Люкс, с лососем в желе, 75 гр.",/product/gourmet-vlazhnyj-korm-perl-zhele-de-lyuks-dlya-koshek-s-lososem-v-roskoshnom-zhele-75-g-89026-1038958/,32 ₽,42 ₽
1002557,"Royal Canin Kitten 36 Second Age Сухой корм для котят в возрасте до 12 месяцев, 4 кг",/product/royal-canin-kitten-36-korm-dlya-kotyat-v-vozraste-ot-4-do-12-mes-4-kg-1019-1002557/,4 999 ₽,Нет старой цены
1063267,"ALLEVA Holistic Сухой корм для кошек, с океанической рыбой, коноплей и алое вера, 1,5 кг",/product/alleva-holistic-korm-suhoj-dlya-koshek-s-okeanicheskoj-ryboj-konoplej-i-aloe-vera-1-5kg-90087-1063267/,3 069 ₽,Нет старой цены
1052487,"DELICANA Premium Сухой корм для стерилизованных кошек, с кроликом, 400 гр.",/product/delicana-korm-dlya-sterilizovannyh-koshek-s-krolikom-400-gr-1228-1052487/,307 ₽,383 ₽
1063270,"ALLEVA Equilibrium Сухой корм для кастрированных котов и стерилизованных кошек, с курицей, 400 гр.",/product/alleva-equilibrium-korm-suhoj-dlya-kastrirovannyh-kotov-i-sterilizovannyh-koshek-s-kuritsej-400g-90090-1063270/,945 ₽,Нет старой цены
1051417,"Brit Premium пауч для взрослых кошек ягненок в желе, 85 гр",/product/brit-premium-pauch-dlya-vzroslyh-koshek-yagnenok-v-zhele-85-gr-88964-1051417/,73 ₽,Нет старой цены
1063320,"Grandorf Fresh Сухой корм для кошек, с уткой и бататом, 400 гр.",/product/grandorf-fresh-korm-suhoj-dlya-koshek-s-utkoj-i-batatom-400-gr-90164-1063320/,1 045 ₽,Нет старой цены
1038956,"Gourmet Влажный корм (пауч) для взрослых кошек Желе Де-Люкс, с говядиной в желе, 75 гр.",/product/gourmet-vlazhnyj-korm-perl-zhele-de-lyuks-dlya-koshek-s-govyadinoj-v-roskoshnom-zhele-75-g-507-1038956/,32 ₽,42 ₽
1052576,"Gourmet Влажный корм (пауч) для взрослых кошек Перл Соус Де-люкс, с лососем в соусе, 75 гр.",/product/gourmet-korm-vlazhnyj-dlya-koshek-kusochki-lososya-v-souse-75-g-521-1052576/,32 ₽,42 ₽
1054904,"Felix Влажный корм (пауч) для взрослых кошек Двойная вкуснятина, с лососем и форелью в желе, 75 гр.",/product/felix-dvojnaya-vkusnyatina-korm-vlazhnyj-dlya-koshek-losos-i-forel-75g-89001-1054904/,30 ₽,33 ₽
1054890,"Felix Sensations Влажный корм (пауч) для взрослых кошек, с индейкой в соусе со вкусом бекона, 75 гр.",/product/felix-sensations-korm-vlazhnyj-dlya-koshek-indejka-so-vkusom-bekona-v-souse-75g-89003-1054890/,30 ₽,33 ₽
1054893,"Felix Влажный корм (пауч) для взрослых кошек Аппетитные кусочки, с говядиной в желе, 75 гр.",/product/felix-appetitnye-kusochki-korm-vlazhnyj-dlya-koshek-s-govyadinoj-75g-88997-1054893/,30 ₽,33 ₽
1058477,"Perfect Fit Влажный корм (пауч) для кошек, с индейкой в желе со спирулиной и клюквой, 75 гр.",/product/perfect-fit-immunity-korm-vlazhnyj-dlya-koshek-indejka-v-zhele-so-spirulinoj-i-klyukvoj-75-gr-584-1058477/,43 ₽,Нет старой цены
1051420,"Brit Premium пауч для взрослых кошек треска в желе, 85 гр",/product/brit-premium-pauch-dlya-vzroslyh-koshek-treska-v-zhele-85-gr-88961-1051420/,73 ₽,Нет старой цены
1063269,"ALLEVA Holistic Cухой корм для кошек, с курицей и уткой, алое вера и женьшенем, 1,5 кг",/product/alleva-holistic-korm-suhoj-dlya-koshek-s-kuritsej-i-utkoj-aloe-vera-i-zhenshenem-1-5kg-90089-1063269/,2 765 ₽,Нет старой цены
1063268,"ALLEVA Holistic Сухой корм для кошек, с ягненком и олениной, коноплей и женьшенем, 1,5 кг",/product/alleva-holistic-korm-suhoj-dlya-koshek-s-yagnenkom-i-oleninoj-konoplej-i-zhenshenem-1-5kg-90088-1063268/,2 765 ₽,Нет старой цены
1054138,"Purina ONE Housecat сухой корм для взрослых кошек при домашнем образе жизни с индейкой и цельными злаками, 1,5 кг",/product/purina-one-housecat-suhoj-korm-dlya-vzroslyh-koshek-pri-domashnem-obraze-zhizni-s-indejkoj-i-tselnymi-zlakami-1-5-kg-864-1054138/,1 079 ₽,Нет старой цены
1054905,"Felix Влажный корм (пауч) для взрослых кошек Двойная вкуснятина, с ягненком и курицей в желе, 75 гр.",/product/felix-dvojnaya-vkusnyatina-korm-vlazhnyj-dlya-koshek-yagnenok-i-kuritsa-75g-89002-1054905/,30 ₽,33 ₽
1058846,"Mealfeel Влажный корм (консервы) для кошек, мусс из курицы с топпингом из тыквы, 85 гр.",/product/mealfeel-konservy-dlya-koshek-muss-iz-kuritsy-s-toppingom-iz-tykvy-85g-83255-1058846/,179 ₽,Нет старой цены
1061118,"Royal Canin Satiety Weight Management Сухой корм для снижения веса у кошек, 400 гр.",/product/royal-canin-korm-suhoj-dlya-koshek-setaeti-vejt-menedzhment-0-4-kg-86565-1061118/,917 ₽,Нет старой цены
1051384,"Brit Premium Cat Adult Chicken сухой корм для взрослых кошек с курицей, 400г",/product/brit-premium-cat-adult-chicken-suhoj-korm-dlya-vzroslyh-koshek-s-kuritsej-400g-931-1051384/,329 ₽,Нет старой цены
1061696,"Royal Canin Kitten Maine Coon Влажный корм для котят породы Мейн Кун, 85 гр.",/product/royal-canin-korm-vlazhnyj-85g-dlya-kotyat-mejn-kun-sous-87617-1061696/,85 ₽,99 ₽
1054898,"Felix Влажный корм (пауч) для взрослых кошек Аппетитные кусочки, с курицей и томатами в желе, 75 гр.",/product/felix-appetitnye-kusochki-korm-vlazhnyj-dlya-koshek-s-kuritsej-i-tomatom-75g-88998-1054898/,30 ₽,33 ₽
1058022,"ProPlan Корм влажный (мультипак) для стерилизованных кошек в соусе: говядина, утка, курица, океаническая рыба, 40х85 гр.",/product/proplan-korm-vlazhnyj-multipak-dlya-sterilizovannyh-koshek-v-souse-govyadina-utka-kuritsa-okeanicheskaya-ryba-40h85-gr-611-1058022/,3 225 ₽,Нет старой цены
1031517,"Felix Влажный корм (пауч) для взрослых кошек, с говядиной в соусе, 48 гр.",/product/felix-sup-vlazhnyj-korm-dlya-vzroslyh-koshek-s-govyadinoj-v-souse-48-g-651-1031517/,26 ₽,Нет старой цены
1048572,"ProPlan Nature Elements Сухой корм для взрослых стерилизованных кошек и кастрированных котов, с курицей, 1,4 кг",/product/proplan-nature-elements-suhoj-korm-dlya-vzroslyh-koshek-dlya-sterilizovannyh-s-kuritsej-1-4-kg-994-1048572/,2 069 ₽,Нет старой цены
1054147,"Purina ONE Влажный корм (пауч) для взрослых кошек с чувствительным пищеварением, с курицей и морковью, 75 гр.",/product/purina-one-sensitive-vlazhnyj-korm-dlya-vzroslyh-koshek-pri-chuvstvitelnom-pishchevarenii-s-kuritsej-i-morkovyu-v-souse-75-g-384-1054147/,46 ₽,Нет старой цены
1003601,"ProPlan Healthy Start Сухой корм для котят, с высоким содержанием курицы, 1,5 кг",/product/proplan-original-suhoj-korm-dlya-kotyat-s-kuritsej-1-5-kg-19-1003601/,1 899 ₽,Нет старой цены
1049807,"Perfect Fit Влажный корм (пауч) для кошек с чувствительным пищеварением, с индейкой в соусе, 75 гр.",/product/perfect-fit-vlazhnyj-korm-dlya-koshek-s-chuvstvitelnym-pishchevareniem-s-indejkoj-v-souse-75-g-45512-1049807/,43 ₽,Нет старой цены
1063273,"ALLEVA Equilibrium Cухой корм для кошек, с рыбой, 1,5 кг",/product/alleva-equilibrium-korm-suhoj-dlya-koshek-sensitiv-s-ryboj-1-5kg-90093-1063273/,2 455 ₽,Нет старой цены
1049994,"Gourmet Влажный корм (пауч) для взрослых кошек Перл Мясной Дуэт, с языком и телятиной в соусе, 75 гр.",/product/gourmet-perl-myasnoj-duet-vlazhnyj-korm-dlya-vzroslyh-koshek-so-vkusom-yazyka-itelyatiny-nezhnoe-file-v-souse-75-g-511-1049994/,32 ₽,42 ₽
1053760,"Sirius Корм сухой для взрослых кошек, с лососем и рисом, 400 гр.",/product/sirius-korm-suhoj-dlya-vzroslyh-koshek-s-lososem-i-risom-400-gr-1246-1053760/,349 ₽,Нет старой цены
1052568,"Gourmet Влажный корм (пауч) для взрослых кошек Перл Нежное филе, с уткой в соусе, 75 гр.",/product/gourmet-korm-vlazhnyj-dlya-koshek-kusochki-utki-v-souse-75-g-513-1052568/,32 ₽,42 ₽
1054018,"UNICA Adult In-home Luxury Hairball сухой корм для домашних кошек с курицей, 300 гр",/product/unica-adult-in-home-luxury-hairball-suhoj-korm-dlya-domashnih-koshek-s-kuritsej-300-gr-1253-1054018/,399 ₽,Нет старой цены
1043392,"Felix Sensations Влажный корм (пауч) для взрослых кошек Супервкус, с говядиной и сыром в желе, 75 гр.",/product/felix-sensations-supervkus-vlazhnyj-korm-dlya-vzroslyh-koshek-s-govyadinoj-i-syrom-v-zhele-75-g-656-1043392/,30 ₽,33 ₽
1051252,"Wellkiss Delice Влажный корм (консервы) для кошек, индейка и телятина, 100 гр.",/product/wellkiss-delice-vlazhnyj-korm-konservy-dlya-koshek-indejka-i-telyatina-100-gr-464-1051252/,145 ₽,Нет старой цены
1020022,"Royal Canin Urinary Care Сухой корм при профилактике мочекаменной болезни для взрослых кошек, 400 гр.",/product/royal-canin-urinary-care-korm-dlya-vzroslyh-koshek-v-tselyah-profilaktiki-mochekamennoj-bolezni-400g-1031-1020022/,747 ₽,Нет старой цены
1049993,"Gourmet Влажный корм (пауч) для взрослых кошек Перл Мясной дуэт, с курицей и кроликом в соусе, 75 гр.",/product/gourmet-perl-myasnoj-duet-vlazhnyj-korm-dlya-vzroslyh-koshek-so-vkusom-kuritsy-ikrolika-nezhnoe-file-v-souse-75-g-510-1049993/,32 ₽,42 ₽
1051250,"Wellkiss Delice Влажный корм (консервы) для кошек, цыпленок и кролик, 100 гр.",/product/wellkiss-delice-vlazhnyj-korm-konservy-dlya-koshek-tsyplenok-i-krolik-100-gr-462-1051250/,145 ₽,Нет старой цены
1048576,"ProPlan Nature Elements Сухой корм для взрослых кошек с чувствительным пищеварением или особыми предпочтениями в еде, с индейкой, 200 гр.",/product/proplan-nature-elements-suhoj-korm-dlya-vzroslyh-koshek-dlya-zdorovya-kozhi-i-shersti-s-indejkoj-200-g-995-1048576/,317 ₽,Нет старой цены
1054900,"Felix Влажный корм (пауч) для взрослых кошек Аппетитные кусочки, с форелью в желе, 75 гр.",/product/felix-appetitnye-kusochki-korm-vlazhnyj-dlya-koshek-s-forelyu-75g-88993-1054900/,30 ₽,33 ₽
1058480,"Perfect Fit Immunity Сухой корм для кошек, с индейкой, спирулиной и клюквой, 580 гр.",/product/perfect-fit-immunity-korm-suhoj-dlya-koshek-indejka-spirulina-i-klyukva-580-gr-978-1058480/,445 ₽,Нет старой цены
1034197,"Royal Canin Urinary S/O Сухой корм для кошек при заболеваниях дистального отдела мочевыделительной системы, модератор калорий, 400 гр.",/product/royal-canin-urinary-s-o-korm-dlya-koshek-pri-zabolevaniyah-distalnogo-otdela-mochevydelitelnoj-sistemy-moderator-kalorij-400-g-3106-1034197/,859 ₽,Нет старой цены
1054142,"Purina ONE Sterilised Сухой корм для взрослых стерилизованных кошек и кастрированных котов, с говядиной и пшеницей, 3 кг",/product/purina-one-sterilised-suhoj-korm-dlya-vzroslyh-koshek-dlya-sterilizovannyh-s-govyadinoj-i-pshenitsej-3-kg-867-1054142/,1 999 ₽,Нет старой цены
1054888,"Felix Sensations Влажный корм (пауч) для взрослых кошек, с уткой в желе со шпинатом, 75 гр.",/product/felix-sensations-korm-vlazhnyj-dlya-koshek-utka-so-shpinatom-v-zhele-75g-664-1054888/,30 ₽,33 ₽
1054983,"Wellkiss Влажный корм (консервы) для кошек, цыпленок с говядиной, 100 гр.",/product/wellkiss-vlazhnyj-korm-konservy-dlya-koshek-tsyplenok-s-govyadinoj-100-gr-478-1054983/,135 ₽,Нет старой цены
1054899,"Felix Влажный корм (пауч) для взрослых кошек Аппетитные кусочки, с лососем в желе, 75 гр.",/product/felix-appetitnye-kusochki-korm-vlazhnyj-dlya-koshek-s-lososem-75g-88999-1054899/,30 ₽,33 ₽
1061166,"Мираторг Сухой корм для стерилизованных кошек, c кроликом, 10 кг",/product/miratorg-korm-suhoj-dlya-sterilizovannyh-koshek-c-krolikom-10kg-86618-1061166/,6 230 ₽,8 899 ₽
1049454,"Whiskas Влажный корм (пауч) для кошек, желе с курицей и индейкой, 75 гр.",/product/whiskas-vlazhnyj-korm-dlya-koshek-zhele-s-kuritsej-i-indejkoj-75-g-496-1049454/,27 ₽,33 ₽
1049448,"Whiskas Влажный корм (пауч) для кошек, желе с курицей, 75 гр.",/product/whiskas-vlazhnyj-korm-dlya-koshek-zhele-s-kuritsej-75-g-490-1049448/,27 ₽,33 ₽
1051251,"Wellkiss Delice Влажный корм (консервы) для кошек, говядина с льняным маслом, 100 гр.",/product/wellkiss-delice-vlazhnyj-korm-konservy-dlya-koshek-govyadina-s-lnyanym-maslom-100-gr-463-1051251/,145 ₽,Нет старой цены
1005152,"ProPlan Derma Care Сухой корм для здоровья шерсти и кожи взрослых кошек, с высоким содержанием лосося, 400 гр.",/product/proplan-elegant-suhoj-korm-dlya-vzroslyh-koshek-dlya-zdorovya-shersti-i-kozhi-s-lososem-400-g-981-1005152/,589 ₽,Нет старой цены
1026167,"ProPlan Delicate сухой корм для взрослых кошек при чувствительном пищеварении с ягненком, 400 г",/product/proplan-delicate-suhoj-korm-dlya-vzroslyh-koshek-pri-chuvstvitelnom-pishchevarenii-s-yagnenkom-400-g-984-1026167/,589 ₽,Нет старой цены
1054140,"Purina ONE Sterilised Сухой корм для взрослых стерилизованных кошек и кастрированных котов, с лососем и пшеницей, 1,5 кг",/product/purina-one-sterilised-suhoj-korm-dlya-vzroslyh-koshek-dlya-sterilizovannyh-s-lososem-i-pshenitsej-1-5-kg-866-1054140/,1 079 ₽,Нет старой цены
1058481,"Perfect Fit Immunity Сухой корм для кошек, с говядиной, семенами льна и голубикой, 5,5 кг",/product/perfect-fit-immunity-korm-suhoj-dlya-koshek-govyadina-semena-lna-i-golubika-5-5-kg-979-1058481/,3 355 ₽,Нет старой цены
1051247,"Wellkiss Delice Влажный корм (консервы) для кошек, нежное филе цыпленка со спаржей, 100 гр.",/product/wellkiss-delice-vlazhnyj-korm-konservy-dlya-koshek-nezhnoe-file-tsyplenka-so-sparzhej-100-gr-461-1051247/,145 ₽,Нет старой цены
1063274,"ALLEVA Equilibrium Сухой корм для кошек, с кроликом, 1,5 кг",/product/alleva-equilibrium-korm-suhoj-dlya-koshek-sensitiv-s-krolikom-1-5kg-90094-1063274/,2 455 ₽,Нет старой цены
1056726,"UNICA Adult Sterilized Lightness Сухой корм для стерилизованных кошек, с уткой, 300 гр.",/product/unica-adult-sterilized-lightness-suhoj-korm-dlya-sterilizovannyh-koshek-s-utkoj-300-gr-1256-1056726/,459 ₽,Нет старой цены
1052573,"Gourmet Влажный корм (пауч) для взрослых кошек Перл Нежное филе, с лососем в соусе, 75 гр.",/product/gourmet-korm-vlazhnyj-dlya-koshek-kusochki-lososya-v-souse-75-g-518-1052573/,32 ₽,42 ₽
1049462,"Whiskas Влажный корм (пауч) для кошек Мясная коллекция, кролик в желе, 75 гр.",/product/whiskas-vlazhnyj-korm-dlya-koshek-myasnaya-kollektsiya-krolik-v-zhele-75-g-504-1049462/,27 ₽,33 ₽
1049458,"Whiskas Влажный корм (пауч) для кошек Аппетитный микс, утка, печень в мясном соусе, 75 гр.",/product/whiskas-vlazhnyj-korm-dlya-koshek-appetitnyj-miks-iz-utki-pecheni-v-myasnom-souse-75-g-500-1049458/,27 ₽,33 ₽
1054886,"Felix Sensations Влажный корм (пауч) для взрослых кошек, с курицей в желе с морковью, 75 гр.",/product/felix-sensations-korm-vlazhnyj-dlya-koshek-kuritsa-s-morkovyu-v-zhele-75g-662-1054886/,30 ₽,33 ₽
1058017,"Purina ONE Сухой корм для взрослых домашних кошек, с индейкой и цельными злаками, 9,75 кг",/product/purina-one-korm-suhoj-dlya-vzroslyh-koshek-s-indejkoj-i-tselnymi-zlakami-9-75-kg-870-1058017/,6 187 ₽,Нет старой цены
1054903,"Felix Влажный корм (пауч) для взрослых кошек Двойная вкуснятина, с индейкой и печенью в желе, 75 гр.",/product/felix-dvojnaya-vkusnyatina-korm-vlazhnyj-dlya-koshek-indejka-i-pechen-75g-667-1054903/,30 ₽,33 ₽
1050748,"Ownat Classic Сухой корм для кошек Ежедневная забота, с курицей, 1.5 кг",/product/ownat-classic-suhoj-korm-dlya-koshek-ezhednevnaya-zabota-s-kuritsej-1-5-kg-1187-1050748/,1 199 ₽,Нет старой цены
1054892,"Felix Sensations Влажный корм (пауч) для взрослых кошек, с уткой в соусе с морковью, 75 гр.",/product/felix-sensations-korm-vlazhnyj-dlya-koshek-utka-s-morkovyu-v-souse-75g-89004-1054892/,30 ₽,33 ₽
1063271,"ALLEVA Equilibrium Сухой корм для взрослых кошек, с курицей, 1,5 кг",/product/alleva-equilibrium-korm-suhoj-dlya-koshek-s-kuritsej-1-5kg-90091-1063271/,2 455 ₽,Нет старой цены
1054891,"Felix Sensations Влажный корм (пауч) для взрослых кошек, с треской в соусе с томатами, 75 гр.",/product/felix-sensations-korm-vlazhnyj-dlya-koshek-treska-s-tomatami-v-souse-75g-89005-1054891/,30 ₽,33 ₽
1000001,"ProPlan Sterilised Renal Plus Сухой корм для поддержания здоровья почек у стерилизованных кошек, с высоким содержанием индейки, 1,5 кг",/product/proplan-sterilised-suhoj-korm-dlya-vzroslyh-koshek-dlya-podderzhaniya-zdorovya-pochek-posle-sterilizatsii-s-indejkoj-1-5-kg-86249-1000001/,1 775 ₽,Нет старой цены
1061160,"NATURE`S TABLE Сухой корм для кошек, со вкусом индейки, 650 гр.",/product/nature-s-table-suhoj-korm-dlya-koshek-indejka-650g-86614-1061160/,388 ₽,553 ₽
1020578,"Perfect Fit Сухой корм для стерилизованных кошек старше 7 лет, с курицей, 650 гр.",/product/perfect-fit-korm-suhoj-dlya-sterilizovannyh-koshek-starshe-7-let-s-kuritsej-650-g-44818-1020578/,445 ₽,Нет старой цены
1049450,"Whiskas Влажный корм (пауч) для кошек, рагу с форелью и лососем, 75 гр.",/product/whiskas-vlazhnyj-korm-dlya-koshek-ragu-s-forelyu-i-lososem-75-g-492-1049450/,27 ₽,33 ₽
1052569,"Gourmet Влажный корм (пауч) для взрослых кошек Перл Нежное филе, с говядиной в соусе, 75 гр.",/product/gourmet-korm-vlazhnyj-dlya-koshek-kusochki-govyadiny-v-souse-75-g-514-1052569/,32 ₽,42 ₽
1053758,"Sirius Корм сухой для взрослых кошек, мясной рацион, 1,5 кг",/product/sirius-korm-suhoj-dlya-vzroslyh-koshek-myasnoj-ratsion-1-5-kg-1244-1053758/,1 135 ₽,Нет старой цены
