ID товара,Наименование товара,Ссылка на товар,Регулярная цена,Старая цена
1057070,"Mealfeel Functional Nutrition Корм сухой для стерилизованных кошек старше 7 лет, с сельдью и лососем, 400 гр.",/product/mealfeel-korm-suhoj-dlya-sterilizovannyh-koshek-starshe-7-let-s-seldyu-i-lososem-400g-1123-1057070/,469 ₽,Нет старой цены
1054752,"Yummy Мясной Деликатес консервы для кошек с индейкой и кроликом, 100 г",/product/yummy-myasnoj-delikates-konservy-dlya-koshek-s-indejkoj-i-krolikom-100-g-89074-1054752/,145 ₽,Нет старой цены
1056422,"Sheba Влажный корм (пауч) для кошек, с паштетом из курицы в желе, 75 гр.",/product/sheba-korm-vlazhnyj-dlya-koshek-pashtet-s-kuritsej-75-g-694-1056422/,42 ₽,Нет старой цены
1054474,"Purina NF Renal Function Advanced care Сухой корм для взрослых кошек при хронической почечной недостаточности для поддержания функции почек (поздняя стадия), 350 гр.",/product/purina-veterinary-diets-nf-renal-function-advanced-care-pozdnyaya-stadiya-suhoj-korm-dlya-vzroslyh-koshek-dlya-podderzhaniya-funktsii-pochek-pri-hronicheskoj-pochechnoj-nedostatochnosti-350-g-3084-1054474/,1 099 ₽,Нет старой цены
1054704,"Mealfeel Корм сухой для кошек старше 7 лет, с курицей и индейкой, 400 гр.",/product/mealfeel-korm-suhoj-dlya-koshek-starshe-7-let-s-kuritsej-i-indejkoj-400-gr-1117-1054704/,469 ₽,Нет старой цены
1054519,"Wellkiss Kitten Delicate Корм сухой для котят с чувствительным пищеварением, с индейкой, 400 гр.",/product/wellkiss-kitten-delicate-korm-suhoj-dlya-kotyat-s-chuvstvitelnym-pishchevareniem-s-indejkoj-400-gr-1103-1054519/,399 ₽,Нет старой цены
1016931,"ProPlan Indoor Влажный корм (пауч) для взрослых кошек живущих дома, с индейкой в желе, 85 гр.",/product/proplan-housecat-vlazhnyj-korm-dlya-vzroslyh-koshek-pri-domashnem-obraze-zhizni-s-indejkoj-v-zhele-85-g-86826-1016931/,89 ₽,Нет старой цены
1051848,"Sheba Влажный корм (пауч) для кошек, с ломтиками кролика в желе, 75 гр.",/product/sheba-korm-vlazhnyj-dlya-koshek-krolik-v-zhele-75-g-82999-1051848/,42 ₽,Нет старой цены
1059356,"Sheba Влажный корм (пауч) для кошек, с ломтиками телятины в желе, 75 гр.",/product/sheba-korm-vlazhnyj-koshek-telyatina-v-zhele-75g-90207-1059356/,42 ₽,Нет старой цены
1053073,"Murmix Консервированный корм для взрослых кошек, кусочки с кроликом в соусе, 85 г",/product/murmix-konservirovannyj-korm-dlya-vzroslyh-koshek-kusochki-s-krolikom-v-souse-85-g-732-1053073/,55 ₽,Нет старой цены
1023900,"Purina Veterinary Diets OM ST/OX Obesity Management Влажный корм (пауч) для снижения избыточной массы тела у взрослых кошек, с курицей в соусе, 85 гр.",/product/purina-veterinary-diets-om-st-ox-obesity-management-vlazhnyj-korm-dlya-vzroslyh-koshek-dlya-snizheniya-izbytochnoj-massy-tela-i-regulyatsii-postupleniya-glyukozy-s-kuritsej-v-souse-85-g-3008-1023900/,199 ₽,Нет старой цены
1041079,"INABA CIAO Влажный корм (консервы) для кошек, куриное филе и тунец магуро с сурими в бульоне, 80 гр.",/product/inaba-ciao-konservy-dlya-koshek-kamchatskij-krab-s-mramornoj-vyrezkoj-zheltoperogotuntsa-i-parnym-file-kuritsy-89046-1041079/,189 ₽,Нет старой цены
1059957,"AlphaPet Adult Monoprotein Сухой корм для взрослых кошек, с белой рыбой, 400 гр.",/product/83737-1059957/,517 ₽,Нет старой цены
1049811,"Perfect Fit Влажный корм (пауч) для стерилизованных кошек, паштет с говядиной, 75 гр.",/product/perfect-fit-vlazhnyj-korm-dlya-sterilizovannyh-koshek-pashtet-s-govyadinoj-75-g-580-1049811/,43 ₽,Нет старой цены
1053565,"Mealfeel Functional Nutrition Влажный корм (пауч) для кошек старше 7 лет, кусочки с домашней птицей в соусе, 85 гр.",/product/mealfeel-functional-nutrition-vlazhnyj-korm-pauch-dlya-koshek-starshe-7-let-kusochki-s-domashnej-ptitsej-v-souse-85-gr-560-1053565/,73 ₽,Нет старой цены
1057270,"Crave Влажный корм (пауч) для взрослых кошек, с ягненком в соусе, 70 гр.",/product/crave-korm-vlazhnyj-dlya-vzroslyh-koshek-s-yagnenkom-v-souse-70-gr-90015-1057270/,85 ₽,99 ₽
1051256,"Wellkiss Delice Влажный корм (консервы) для кошек, с индейкой и уткой, 240 гр.",/product/wellkiss-delice-vlazhnyj-korm-konservy-dlya-koshek-s-indejkoj-i-utkoj-240-gr-465-1051256/,165 ₽,Нет старой цены
1054517,"Wellkiss Adult Salmon Корм сухой для кошек, с лососем, 400 гр.",/product/wellkiss-adult-salmon-korm-suhoj-dlya-koshek-s-lososem-400-gr-1102-1054517/,399 ₽,Нет старой цены
1053575,"Wellkiss Adult Влажный корм (пауч) для взрослых кошек, с курицей в желе, 85 гр.",/product/wellkiss-adult-vlazhnyj-korm-pauch-dlya-vzroslyh-koshek-s-kuritsej-v-zhele-85-gr-473-1053575/,63 ₽,Нет старой цены
1056423,"Sheba Влажный корм (пауч) для кошек, с паштетом из говядины в желе, 75 гр.",/product/sheba-korm-vlazhnyj-dlya-koshek-pashtet-s-govyadinoj-75-g-90205-1056423/,42 ₽,Нет старой цены
1042263,"Ownat Adult Sterilized Ultra Сухой корм для стерилизованных кошек, с индейкой, 1,5 кг",/product/ownat-adult-sterilized-ultra-suhoj-korm-dlya-sterilizovannyh-koshek-s-indejkoj-1-5-kg-1185-1042263/,1 999 ₽,Нет старой цены
1053075,"Murmix Консервированный корм для котят, кусочки с курицей в соусе, 85 г",/product/murmix-konservirovannyj-korm-dlya-kotyat-kusochki-s-kuritsej-v-souse-85-g-734-1053075/,55 ₽,Нет старой цены
1053072,"Murmix Консервированный корм для взрослых кошек, кусочки с курицей и индейкой всоусе, 85 г",/product/murmix-konservirovannyj-korm-dlya-vzroslyh-koshek-kusochki-s-kuritsej-i-indejkoj-vsouse-85-g-731-1053072/,55 ₽,Нет старой цены
1050749,"Ownat Adult Classic Корм сухой для кошек, с рыбой, 1.5 кг",/product/ownat-adult-classic-korm-suhoj-dlya-koshek-s-ryboj-1-5-kg-1188-1050749/,1 199 ₽,Нет старой цены
1060907,"Деревенские лакомств Влажный корм (пауч) для кошек, суп из курицы с говядиной и шпинатом, 35 гр.",/product/derevenskie-lakomstv-pauch-d-koshek-sup-iz-kuritsy-s-govyadinoj-i-shpinatom-35g-90233-1060907/,89 ₽,Нет старой цены
1044483,"UnoCat Влажный корм для котят нежные кусочки с цыпленком и телятиной в соусе, 85гр",/product/unocat-vlazhnyj-korm-dlya-kotyat-nezhnye-kusochki-s-tsyplenkom-i-telyatinoj-v-souse-85gr-703-1044483/,29 ₽,Нет старой цены
1053074,"Murmix Консервированный корм для взрослых кошек, кусочки лосося с форелью в соусе, 85 г",/product/murmix-konservirovannyj-korm-dlya-vzroslyh-koshek-kusochki-lososya-s-forelyu-v-souse-85-g-733-1053074/,55 ₽,Нет старой цены
1060678,"Sirius Влажный корм (пауч) для стерилизованных кошек, с индейкой и курицей, 85 гр.",/product/sirius-korm-vlazhnyj-dlya-sterilizovannyh-koshek-indejka-i-kuritsa-85-g-85515-1060678/,77 ₽,Нет старой цены
1060909,"Деревенские лакомств Влажный корм (пауч) для кошек, суп из курицы с уткой и тыквой, 35 гр.",/product/derevenskie-lakomstv-pauch-d-koshek-sup-iz-kuritsy-s-utkoj-i-tykvoj-35g-86216-1060909/,89 ₽,Нет старой цены
1053895,"Farmina PRIME влажный корм для кошек с курицей и гранатом, 70 г",/product/farmina-prime-vlazhnyj-korm-dlya-koshek-s-kuritsej-i-granatom-70-g-86923-1053895/,259 ₽,Нет старой цены
1063322,"Grandorf Fresh Сухой корм для стерилизованных кошек, с ягненком и бататом, 400 гр.",/product/grandorf-fresh-korm-suhoj-dlya-sterilizovannyh-koshek-s-yagnenkom-i-batatom-400-gr-90165-1063322/,1 045 ₽,Нет старой цены
1041075,"INABA CIAO Влажный корм (консервы) для кошек, куриное филе и тунец магуро с кальмаром в бульоне, 80 гр.",/product/inaba-ciao-konservy-dlya-koshek-kalmar-s-mramornoj-vyrezkoj-yaponskogo-tuntsa-bonito-iparnym-file-kuritsy-89049-1041075/,189 ₽,Нет старой цены
1051841,"Sheba Влажный корм (пауч) для кошек Аппетитные ломтики, с форелью и креветками в соусе, 75 гр.",/product/sheba-korm-vlazhnyj-dlya-koshek-forel-i-krevetki-v-souse-75-g-90214-1051841/,42 ₽,Нет старой цены
1054718,"Wellkiss Влажный корм (консервы) для кошек, нежные кусочки с говядиной в желе, 410 гр.",/product/wellkiss-vlazhnyj-korm-konservy-dlya-koshek-nezhnye-kusochki-s-govyadinoj-v-zhele-410-gr-89065-1054718/,135 ₽,Нет старой цены
1053571,"Mealfeel Functional Nutrition Sterilized Влажный корм (ламистер) для кошек, с тунцом, 100 гр.",/product/mealfeel-functional-nutrition-sterilized-vlazhnyj-korm-lamister-dlya-koshek-s-tuntsom-100-gr-566-1053571/,79 ₽,Нет старой цены
1053561,"Mealfeel Functional Nutrition Влажный корм (пауч) для взрослых кошек, ягненок в соусе с кусочками куриного филе, 85 гр.",/product/mealfeel-functional-nutrition-vlazhnyj-korm-pauch-dlya-vzroslyh-koshek-yagnenok-v-souse-s-kusochkami-kurinogo-file-85-gr-556-1053561/,73 ₽,Нет старой цены
1063328,"Grandorf Fresh Сухой корм для стерилизованных кошек, с уткой и бататом, 400 гр.",/product/grandorf-fresh-korm-suhoj-dlya-sterilizovannyh-koshek-s-utkoj-i-batatom-400-gr-90168-1063328/,1 045 ₽,Нет старой цены
1060676,"Sirius Влажный корм (пауч) для котят, с индейкой и курицей, 85 гр.",/product/sirius-korm-vlazhnyj-dlya-kotyat-indejka-i-kuritsa-85-g-85513-1060676/,77 ₽,Нет старой цены
1061692,"Royal Canin Light Weight Влажный корм (пауч) для взрослых кошек с избыточным весом, 85 гр.",/product/royal-canin-korm-vlazhnyj-85g-dlya-koshek-lajt-sous-87613-1061692/,99 ₽,Нет старой цены
1041077,"INABA CIAO Влажный корм (консервы) для кошек, куриное филе и тунец кацуо с мальками ширасу в бульоне, 80 гр.",/product/inaba-ciao-konservy-dlya-koshek-melkaya-molodaya-seld-s-parnym-file-kuritsy-i-yaponskimtuntsom-bonito-89050-1041077/,189 ₽,Нет старой цены
1059357,"Sheba Влажный корм (пауч) для кошек, с ломтиками форели в желе, 75 гр.",/product/sheba-korm-vlazhnyj-koshek-forel-v-zhele-75g-90208-1059357/,42 ₽,Нет старой цены
1053560,"Mealfeel Functional Nutrition Влажный корм (пауч) для взрослых кошек, курица в соусе с цельными кусочками филе, 85 гр.",/product/mealfeel-functional-nutrition-vlazhnyj-korm-pauch-dlya-vzroslyh-koshek-kuritsa-v-souse-s-tselnymi-kusochkami-file-85-gr-555-1053560/,73 ₽,Нет старой цены
1061640,AlphaPet Влажный корм для кошек нежные ломтики ягненка с потрошками в соусе 80г,/product/alphapet-vlazhnyj-korm-dlya-koshek-nezhnye-lomtiki-yagnenka-s-potroshkami-v-souse-80g-87587-1061640/,65 ₽,Нет старой цены
1030234,"ProPlan Sterilised Delicate Digestion Сухой корм для взрослых стерилизованных кошек и кастрированных котов с чувствительным пищеварением, с курицей, 400 гр.",/product/proplan-sterilised-suhoj-korm-dlya-vzroslyh-koshek-dlya-sterilizovannyh-s-chuvstvitelnym-pishchevareniem-s-kuritsej-400-g-985-1030234/,639 ₽,Нет старой цены
1051845,"Sheba Влажный корм (пауч) для кошек Аппетитные ломтики, с курицей и индейкой в соусе, 75 гр.",/product/sheba-korm-vlazhnyj-dlya-koshek-kuritsa-i-indejka-v-souse-75-g-90216-1051845/,42 ₽,Нет старой цены
1053568,"Mealfeel Functional Nutrition Digest Sensitive Влажный корм (ламистер) для кошек, с океанической рыбой, 100 гр.",/product/mealfeel-functional-nutrition-digest-sensitive-vlazhnyj-korm-lamister-dlya-koshek-s-okeanicheskoj-ryboj-100-gr-563-1053568/,79 ₽,Нет старой цены
1051846,"Sheba Влажный корм (пауч) для кошек Аппетитные ломтики, с телятиной и языком в соусе, 75 гр.",/product/sheba-korm-vlazhnyj-dlya-koshek-telyatina-i-yazyk-v-souse-75-g-90217-1051846/,42 ₽,Нет старой цены
1049806,"Perfect Fit Влажный корм (пауч) для стерилизованных кошек, с курицей в соусе, 75 гр.",/product/perfect-fit-vlazhnyj-korm-dlya-sterilizovannyh-koshek-s-kuritsej-v-souse-75-g-578-1049806/,43 ₽,Нет старой цены
1051246,"Wellkiss Delice Влажный корм (консервы) для котят, нежная телятина, 100 гр.",/product/wellkiss-delice-vlazhnyj-korm-konservy-dlya-kotyat-nezhnaya-telyatina-100-gr-460-1051246/,135 ₽,Нет старой цены
1057998,"Mealfeel Sterilized Влажный корм (консервы) для стерилизованных кошек, паштет из курицы, 100 гр.",/product/mealfeel-konservy-dlya-sterilizovannyh-koshek-pashtet-iz-kuritsy-100g-573-1057998/,93 ₽,Нет старой цены
1050545,Brit Premium пауч для взрослых стерилизованных кошек цыпленок в соусе,/product/brit-premium-pauch-dlya-vzroslyh-sterilizovannyh-koshek-tsyplenok-v-souse-88975-1050545/,73 ₽,Нет старой цены
1054757,"Yummy Мясной Деликатес консервы для кошек с цыпленком и лососем, 100 г",/product/yummy-myasnoj-delikates-konservy-dlya-koshek-s-tsyplenkom-i-lososem-100-g-89073-1054757/,145 ₽,Нет старой цены
1051178,"INABA CIAO Влажный корм (пауч) для кошек, куриное филе с кацуобуси в желе, 60 гр.",/product/inaba-ciao-pauch-dlya-koshek-kurinoe-file-s-katsuobusi-v-zhele-60-g-89052-1051178/,159 ₽,Нет старой цены
1054672,"Четвероногий Гурман Влажный корм (консервы) для кошек и котят с 1 месяца, мусс с курицей, 100 гр.",/product/chetveronogij-gurman-konservy-dlya-koshek-s-kuritsej-89101-1054672/,165 ₽,Нет старой цены
1054723,"Wellkiss Влажный корм (консервы) для кошек, нежные кусочки с кроликом в соусе, 410 гр.",/product/wellkiss-vlazhnyj-korm-konservy-dlya-koshek-nezhnye-kusochki-s-krolikom-v-souse-410-gr-476-1054723/,135 ₽,Нет старой цены
1058844,"Mealfeel Влажный корм (консервы) для кошек, мусс из тунца с топпингом из креветок, 85 гр.",/product/mealfeel-konservy-dlya-koshek-muss-iz-tuntsa-s-toppingom-iz-krevetok-85g-83254-1058844/,179 ₽,Нет старой цены
1000709,"Royal Canin Hair and Skin Care 33 Сухой корм для поддержания здоровья кожи и шерсти у взрослых кошек, 10 кг",/product/royal-canin-hair-and-skin-care-33-korm-dlya-vzroslyh-koshek-v-tselyah-podderzhaniya-zdorovya-kozhi-i-shersti-10-kg-1008-1000709/,14 347 ₽,Нет старой цены
1049809,"Perfect Fit Влажный корм (пауч) для котят, с курицей в соусе, 75 гр.",/product/perfect-fit-vlazhnyj-korm-dlya-kotyat-s-kuritsej-v-souse-75-g-579-1049809/,43 ₽,Нет старой цены
1062910,"ALLEVA Cat Adult Obesity Glycemic Control Сухой диетический корм для кошек, 1,5 кг",/product/alleva-care-korm-suhoj-dlya-koshek-obesiti-1-5kg-89326-1062910/,2 975 ₽,Нет старой цены
1060680,"Sirius Влажный корм (пауч) для стерилизованных кошек, с уткой и клюквой, 85 гр.",/product/sirius-korm-vlazhnyj-dlya-sterilizovannyh-koshek-utka-s-klyukvoj-85-g-85517-1060680/,77 ₽,Нет старой цены
1058850,"Mealfeel Влажный корм (консервы) для кошек, цыпленок с топпингом из анчоусов в желе, 85 гр.",/product/mealfeel-konservy-dlya-koshek-tsyplenok-s-toppingom-iz-anchousov-v-zhele-85g-83258-1058850/,179 ₽,Нет старой цены
1058001,"Mealfeel Digest sensitive Влажный корм (консервы) для взрослых кошек с чувствительным пищеварением, паштет из индейки с кроликом, 100 гр.",/product/mealfeel-konservy-dlya-vzroslyh-koshek-s-chuvstvitelnym-pishchevareniem-pashtet-iz-indejki-s-krolikom-100g-576-1058001/,93 ₽,Нет старой цены
1051842,"Sheba Влажный корм (пауч) для кошек Аппетитные ломтики, с лососем в соусе, 75 гр.",/product/sheba-korm-vlazhnyj-dlya-koshek-losos-v-souse-75-g-90215-1051842/,42 ₽,Нет старой цены
1009847,"Royal Canin Ageing Sterilised 12+ Сухой корм для стерилизованных кошек старше 12 лет, 2 кг",/product/royal-canin-ageing-sterilised-12-korm-dlya-sterilizovannyh-koshek-starshe-12-let-2-kg-1026-1009847/,2 659 ₽,Нет старой цены
1050542,"Brit Premium Влажный корм (пауч) для котят, цыпленок в соусе, 85 гр.",/product/brit-premium-pauch-dlya-kotyat-tsyplenok-v-souse-88953-1050542/,73 ₽,Нет старой цены
1053564,"Mealfeel Functional Nutrition Влажный корм (пауч) для взрослых кошек с чувствительным пищеварением, кусочки с домашней птицей в соусе, 85 гр.",/product/mealfeel-functional-nutrition-vlazhnyj-korm-pauch-dlya-vzroslyh-koshek-s-chuvstvitelnym-pishchevareniem-kusochki-s-domashnej-ptitsej-v-souse-85-gr-559-1053564/,73 ₽,Нет старой цены
1041087,"UnoCat Влажный корм для стерилизованных кошек нежные кусочки с курицей в соусе, 85гр",/product/unocat-vlazhnyj-korm-dlya-sterilizovannyh-koshek-nezhnye-kusochki-s-kuritsej-v-souse-85gr-700-1041087/,29 ₽,Нет старой цены
1053732,"AlphaPet WOW Сухой корм для стерилизованных кошек с цыпленком, 1,5 кг",/product/alphapet-wow-suhoj-korm-dlya-sterilizovannyh-koshek-s-tsyplenkom-1-5-kg-1235-1053732/,909 ₽,Нет старой цены
1062848,"Farmina Vet Life Diabetic Диетический корм для кошек при сахарном диабете, 85г",/product/farmina-vet-life-diabetic-dieticheskij-korm-dlya-koshek-pri-saharnom-diabete-85g-89251-1062848/,249 ₽,Нет старой цены
1053913,"UNICA Indoor сухой корм для кошек с ягненком, рисом и горохом, 350 гр",/product/unica-indoor-suhoj-korm-dlya-koshek-s-yagnenkom-risom-i-gorohom-350-gr-1250-1053913/,391 ₽,459 ₽
1054722,"Wellkiss Влажный корм (консервы) для кошек, нежные кусочки с ягненком в желе, 410 гр.",/product/wellkiss-vlazhnyj-korm-konservy-dlya-koshek-nezhnye-kusochki-s-yagnenkom-v-zhele-410-gr-89068-1054722/,135 ₽,Нет старой цены
1053506,"Sheba Влажный корм (пауч) для кошек Натуральная коллекция, с курицей со сладким перцем, 75 гр.",/product/sheba-korm-vlazhnyj-dlya-koshek-kuritsa-so-sladkim-pertsem-75-g-87612-1053506/,42 ₽,Нет старой цены
1054720,"Wellkiss Влажный корм (консервы) для кошек, нежные кусочки с курицей в желе, 410 гр.",/product/wellkiss-vlazhnyj-korm-konservy-dlya-koshek-nezhnye-kusochki-s-kuritsej-v-zhele-410-gr-89067-1054720/,135 ₽,Нет старой цены
1000862,"Royal Canin Urinary s/o LP34 Сухой корм при заболеваниях дистального отдела мочевыделительной системы у кошек, 1,5 кг",/product/royal-canin-urinary-s-o-lp34-korm-dlya-koshek-pri-zabolevaniyah-distalnogo-otdela-mochevydelitelnoj-sistemy-1-5-kg-3091-1000862/,2 659 ₽,Нет старой цены
1000862,"Royal Canin Urinary s/o LP34 Сухой корм при заболеваниях дистального отдела мочевыделительной системы у кошек, 1,5 кг",/product/royal-canin-urinary-s-o-lp34-korm-dlya-koshek-pri-zabolevaniyah-distalnogo-otdela-mochevydelitelnoj-sistemy-1-5-kg-3091-1000862/,2 659 ₽,Нет старой цены
1054719,"Wellkiss Влажный корм (консервы) для кошек, нежные кусочки с лососем и тунцом в желе, 410 гр.",/product/wellkiss-vlazhnyj-korm-konservy-dlya-koshek-nezhnye-kusochki-s-lososem-i-tuntsom-v-zhele-410-gr-89066-1054719/,135 ₽,Нет старой цены
1054753,"Yummy Мясной Деликатес консервы для кошек с цыпленком и креветками, 100 г",/product/yummy-myasnoj-delikates-konservy-dlya-koshek-s-tsyplenkom-i-krevetkami-100-g-862-1054753/,145 ₽,Нет старой цены
1056405,"Mealfeel Корм сухой для взрослых кошек крупных пород, с индейкой и курицей, 400 гр.",/product/mealfeel-korm-suhoj-dlya-vzroslyh-koshek-krupnyh-porod-s-indejkoj-i-kuritsej-400-gr-1121-1056405/,469 ₽,Нет старой цены
1041088,"UnoCat Влажный корм для привередливых кошек нежные кусочки с ягненком в соусе, 85гр",/product/unocat-vlazhnyj-korm-dlya-priveredlivyh-koshek-nezhnye-kusochki-s-yagnenkom-v-souse-85gr-701-1041088/,29 ₽,Нет старой цены
1030526,"Royal Canin Neutered Satiety Balance Сухой корм для стерилизованных кошек и кастрированных котов, 1,5 кг",/product/royal-canin-korm-suhoj-dlya-koshek-nyutrid-sataeti-belens-1-5-kg-3105-1030526/,2 419 ₽,Нет старой цены
1053909,"UNICA Indoor сухой корм для кошек с курицей, морковью и рисом, 350 гр",/product/unica-indoor-suhoj-korm-dlya-koshek-s-kuritsej-morkovyu-i-risom-350-gr-1248-1053909/,442 ₽,519 ₽
1054754,"Yummy Мясной Деликатес консервы для кошек с цыпленком и тунцом, 100 г",/product/yummy-myasnoj-delikates-konservy-dlya-koshek-s-tsyplenkom-i-tuntsom-100-g-89070-1054754/,145 ₽,Нет старой цены
1054896,"Felix Влажный корм (пауч) для взрослых кошек Аппетитные кусочки, с кроликом в желе, 75 гр.",/product/felix-appetitnye-kusochki-korm-vlazhnyj-dlya-koshek-s-krolikom-75g-88992-1054896/,30 ₽,33 ₽
1055627,"Sheba Влажный корм (пауч) для кошек, с ломтиками говядины и кролика в соусе, 75 гр.",/product/sheba-korm-vlazhnyj-dlya-koshek-lomtiki-v-souse-s-govyadinoj-i-krolikom-75-g-90211-1055627/,42 ₽,Нет старой цены
1063276,"ALLEVA Equilibrium Cухой корм для кастрированных котов и стерилизованных кошек, с рыбой, 1,5 кг",/product/alleva-equilibrium-korm-suhoj-dlya-kastrirovannyh-kotov-i-sterilizovannyh-koshek-s-ryboj-1-5kg-90096-1063276/,2 455 ₽,Нет старой цены
1054524,"Wellkiss Senior Sterilized Корм сухой для кошек старше 7 лет, с индейкой, 400 гр.",/product/wellkiss-senior-sterilized-korm-suhoj-dlya-koshek-starshe-7-let-s-indejkoj-400-gr-1105-1054524/,399 ₽,Нет старой цены
