ID товара,Наименование товара,Ссылка на товар,Регулярная цена,Старая цена
1061057,"Monge Adult cat Влажный корм (пауч) для взрослых кошек, с зелёным горошком и мини-морковью, 80 гр.",/product/monge-korm-vlazhnyj-dlya-koshek-zelenyj-goroshek-i-mini-morkov-80g-86524-1061057/,209 ₽,Нет старой цены
1054140,"Purina ONE Sterilised Сухой корм для взрослых стерилизованных кошек и кастрированных котов, с лососем и пшеницей, 1,5 кг",/product/purina-one-sterilised-suhoj-korm-dlya-vzroslyh-koshek-dlya-sterilizovannyh-s-lososem-i-pshenitsej-1-5-kg-866-1054140/,1 079 ₽,Нет старой цены
1058481,"Perfect Fit Immunity Сухой корм для кошек, с говядиной, семенами льна и голубикой, 5,5 кг",/product/perfect-fit-immunity-korm-suhoj-dlya-koshek-govyadina-semena-lna-i-golubika-5-5-kg-979-1058481/,3 355 ₽,Нет старой цены
1060283,"Whiskas Сухой корм для кошек, курица и индейка, 1,9 кг",/product/whiskas-korm-suhoj-dlya-koshek-assorti-podushechki-s-pashtetom-kuritsa-indejka-1-9kg-84712-1060283/,684 ₽,855 ₽
1063274,"ALLEVA Equilibrium Сухой корм для кошек, с кроликом, 1,5 кг",/product/alleva-equilibrium-korm-suhoj-dlya-koshek-sensitiv-s-krolikom-1-5kg-90094-1063274/,2 455 ₽,Нет старой цены
1052573,"Gourmet Влажный корм (пауч) для взрослых кошек Перл Нежное филе, с лососем в соусе, 75 гр.",/product/gourmet-korm-vlazhnyj-dlya-koshek-kusochki-lososya-v-souse-75-g-518-1052573/,32 ₽,42 ₽
1037871,"Royal Canin Satiety Weight Management сухой диетический корм для взрослых кошек с избыточным весом, 3,5кг",/product/royal-canin-satiety-weight-management-suhoj-dieticheskij-korm-dlya-vzroslyh-koshek-s-izbytochnym-vesom-3-5kg-3108-1037871/,6 307 ₽,Нет старой цены
1052574,"Gourmet Влажный корм (пауч) для взрослых кошек Перл Соус Де-люкс, с говядиной в соусе, 75 гр.",/product/gourmet-korm-vlazhnyj-dlya-koshek-kusochki-govyadiny-v-souse-75-g-519-1052574/,32 ₽,42 ₽
1041476,"Perfect Fit Сухой корм для кошек для красоты шерсти и здоровья кожи, с индейкой, 650 гр.",/product/perfect-fit-korm-suhoj-dlya-koshek-dlya-krasoty-shersti-i-zdorovya-kozhi-s-indejkoj-650g-45333-1041476/,445 ₽,Нет старой цены
1049452,"Whiskas Влажный корм (пауч) для кошек, паштет с уткой, 75 гр.",/product/whiskas-vlazhnyj-korm-dlya-koshek-pashtet-s-utkoj-75-g-494-1049452/,27 ₽,33 ₽
1058017,"Purina ONE Сухой корм для взрослых домашних кошек, с индейкой и цельными злаками, 9,75 кг",/product/purina-one-korm-suhoj-dlya-vzroslyh-koshek-s-indejkoj-i-tselnymi-zlakami-9-75-kg-870-1058017/,6 187 ₽,Нет старой цены
1063271,"ALLEVA Equilibrium Сухой корм для взрослых кошек, с курицей, 1,5 кг",/product/alleva-equilibrium-korm-suhoj-dlya-koshek-s-kuritsej-1-5kg-90091-1063271/,2 455 ₽,Нет старой цены
1061169,"Мираторг Сухой корм для беременных кошек и котят до 4 месяцев, с куриной грудкой, 10 кг",/product/miratorg-korm-suhoj-dlya-beremennyh-koshek-i-kotyat-do-4-mes-s-kurinoj-grudkoj-10kg-86621-1061169/,5 950 ₽,8 499 ₽
1049442,"Whiskas Влажный корм для кошек, паштет с индейкой и кроликом, 75 г",/product/whiskas-vlazhnyj-korm-dlya-koshek-pashtet-s-indejkoj-i-krolikom-75-g-484-1049442/,27 ₽,33 ₽
1053471,"Grand Prix Корм сухой для кошек с чувствительным пищеварением с индейкой, 300 гр",/product/grand-prix-korm-suhoj-dlya-koshek-s-chuvstvitelnym-pishchevareniem-s-indejkoj-300-gr-1233-1053471/,313 ₽,Нет старой цены
1053989,"Felix Cухой корм для взрослых кошек Двойная вкуснятина, с птицей, 200 гр.",/product/felix-dvojnaya-vkusnyatina-suhoj-korm-dlya-vzroslyh-koshek-dlya-vzroslyh-koshek-s-ptitsej-200-g-44845-1053989/,135 ₽,Нет старой цены
1060801,"BOWL WOW Adult Cухой корм для взрослых кошек с индейкой и яблоком, 400 гр.",/product/bowl-wow-korm-suhoj-dlya-vzroslyh-koshek-s-indejkoj-i-yablokom-pak-0-4kg-86122-1060801/,408 ₽,Нет старой цены
1051884,"Grandin Indoor Сухой корм для кошек, с ягненком, 1,5 кг",/product/grandin-indoor-suhoj-korm-dlya-koshek-s-yagnenkom-1-5-kg-1135-1051884/,1 849 ₽,Нет старой цены
1051416,"Brit Premium пауч для взрослых кошек ассорти из птицы в желе, 85 гр",/product/brit-premium-pauch-dlya-vzroslyh-koshek-assorti-iz-ptitsy-v-zhele-85-gr-88960-1051416/,69 ₽,Нет старой цены
1049532,"Felix Cухой корм для взрослых кошек Мясное объедение, с курицей, 3 кг",/product/felix-myasnoe-obedenie-suhoj-korm-dlya-vzroslyh-koshek-s-kuritsej-1-3-kg-1125-1049532/,719 ₽,Нет старой цены
1059507,"Brit Care Indoor Сухой корм для кошек, с индейкой и лососем, 400 гр.",/product/brit-korm-suhoj-dlya-vzroslyh-koshek-s-indejkoj-i-lososem-400g-83136-1059507/,529 ₽,Нет старой цены
1016797,"Perfect Fit Сухой корм для домашних кошек, с курицей, 1,2 кг",/product/perfect-fit-korm-suhoj-dlya-domashnih-koshek-s-kuritsej-1-2-kg-974-1016797/,765 ₽,Нет старой цены
1051401,"Brit Premium Cat Duck&Chicken сухой корм для стерилизованных кошек с уткой и курицей, 400г",/product/brit-premium-cat-duck-chicken-suhoj-korm-dlya-sterilizovannyh-koshek-s-utkoj-i-kuritsej-400g-934-1051401/,335 ₽,Нет старой цены
1060657,"Chat&Chat Adult Sterilized Сухой корм для стерилизованных кошек, с белым мясом птицы, 2 кг",/product/korm-suhoj-dlya-sterilizovannyh-koshek-s-belym-myasom-ptittsy-2kg-85502-1060657/,758 ₽,1 165 ₽
1063785,"Whiskas Сухой корм для кошек, подушечки с паштетом из курицы и индейки, 1,3 кг",/product/whiskas-korm-suhoj-dlya-koshek-podushechki-pashtet-kuritsa-indejka-1-3kg-91136-1063785/,585 ₽,Нет старой цены
1050590,Brit Корм сухой для стерилизованных кошек с курицей 2кг,/product/brit-korm-suhoj-dlya-sterilizovannyh-koshek-s-kuritsej-2kg-930-1050590/,1 449 ₽,Нет старой цены
1051419,"Brit Premium пауч для взрослых кошек цыпленок в желе, 85 гр",/product/brit-premium-pauch-dlya-vzroslyh-koshek-tsyplenok-v-zhele-85-gr-86912-1051419/,69 ₽,Нет старой цены
1063298,"UNICA Outdoor Сухой корм для кошек с треской, рисом и бананами, 1,5 кг",/product/unica-natura-korm-suhoj-dlya-koshek-autdor-s-treskoj-risom-i-bananami-1-5-kg-90149-1063298/,1 999 ₽,Нет старой цены
1063661,"ALLEVA Allergocontrol Hydrolyzed Сухой диетический корм для кошек, с океанической рыбой, 5 кг",/product/alleva-care-korm-suhoj-dlya-koshek-allergokontrol-5kg-90984-1063661/,12 279 ₽,Нет старой цены
1063665,"ALLEVA Urinary 360 Сухой диетический корм для кошек, куриное яйцо, 5 кг",/product/alleva-care-korm-suhoj-dlya-koshek-urinari-5kg-90988-1063665/,9 723 ₽,Нет старой цены
1063783,"Whiskas Сухой корм для стерилизованных кошек, подушечки с паштетом из говядины, 1,3 кг",/product/whiskas-korm-suhoj-dlya-sterilizovannyh-koshek-s-govyadinoj-1-3kg-91134-1063783/,585 ₽,Нет старой цены
1063784,"Whiskas Сухой корм для кошек, подушечки с паштетом из говядины, 1,3 кг",/product/whiskas-korm-suhoj-dlya-koshek-podushechki-pashtet-govyadina-1-3kg-91135-1063784/,585 ₽,Нет старой цены
1051858,"Grandin Влажный корм (консервы) для взрослых кошек, филе тунца в желе, 80 гр.",/product/grandin-vlazhnyj-korm-konservy-dlya-vzroslyh-koshek-file-tuntsa-v-zhele-80-gr-88935-1051858/,199 ₽,Нет старой цены
1051856,"Grandin Влажный корм (консервы) для взрослых кошек, филе тунца с топпингом из креветок в желе, 80 гр.",/product/grandin-vlazhnyj-korm-konservy-dlya-vzroslyh-koshek-file-tuntsa-s-toppingom-iz-krevetok-v-zhele-80-gr-753-1051856/,199 ₽,Нет старой цены
1051857,"Grandin Влажный корм (консервы) для взрослых кошек, филе тунца с топпингом из лосося, 80 гр.",/product/grandin-vlazhnyj-korm-konservy-dlya-vzroslyh-koshek-file-tuntsa-s-toppingom-iz-lososya-80-gr-88931-1051857/,199 ₽,Нет старой цены
1055466,"Grandin Влажный корм для взрослых кошек, тунец с курицей и креветками в нежном желе, 85 гр.",/product/grandin-vlazhnyj-korm-dlya-vzroslyh-koshek-tunets-s-kuritsej-i-krevetkami-v-nezhnom-zhele-85-gr-759-1055466/,219 ₽,Нет старой цены
1061424,"Ownat Author Сухой корм беззерновой для стерилизованных кошек, со свежим мясом курицы, 1,5 кг",/product/ownat-korm-bezzernovoj-dlya-sterilizovannyh-koshek-so-svezhim-myasom-kuritsy-1-5-kg-87300-1061424/,2 599 ₽,Нет старой цены
1055470,"Grandin Влажный корм для взрослых кошек, курица в нежном желе, 85 гр.",/product/grandin-vlazhnyj-korm-dlya-vzroslyh-koshek-kuritsa-v-nezhnom-zhele-85-gr-89031-1055470/,219 ₽,Нет старой цены
1061427,"Ownat Adult Sterilized Grain Free Prime Сухой корм для стерилизованных кошек, с рыбой, 1 кг",/product/ownat-korm-dlya-sterilizovannyh-koshek-s-ryboj-1-kg-87301-1061427/,1 949 ₽,Нет старой цены
1051859,"Grandin Влажный корм (консервы) для взрослых кошек, филе тунца с топпингом из филе цыпленка, 80 гр.",/product/grandin-vlazhnyj-korm-konservy-dlya-vzroslyh-koshek-file-tuntsa-s-toppingom-iz-file-tsyplenka-80-gr-88932-1051859/,199 ₽,Нет старой цены
1051860,"Grandin Влажный корм (консервы) для взрослых кошек, филе тунца с топпингом из рыбы ширасу в желе, 80 гр.",/product/grandin-vlazhnyj-korm-konservy-dlya-vzroslyh-koshek-file-tuntsa-s-toppingom-iz-ryby-shirasu-v-zhele-80-gr-88934-1051860/,199 ₽,Нет старой цены
1055471,"Grandin Влажный корм для взрослых кошек, курица с морским окунем в нежном желе, 85 гр.",/product/grandin-vlazhnyj-korm-dlya-vzroslyh-koshek-kuritsa-s-morskim-okunem-v-nezhnom-zhele-85-gr-89032-1055471/,219 ₽,Нет старой цены
1002270,"Purina DM St/Ox Diabetes Management Сухой диетический корм при сахарном диабете для кошек, 1,5 кг",/product/purina-suhoj-korm-polnoratsionnyj-dieticheskij-veterinary-diets-dm-st-ox-diabetes-management-dlya-vzroslyh-koshek-dlya-regulyatsii-postupleniya-glyukozy-pri-saharnom-diabete-s-nizkim-urovnem-saharov-mono-i-disaharidov-1-5-kg-3073-1002270/,3 999 ₽,Нет старой цены
1055472,"Grandin Влажный корм для котят, тунец в нежном желе, 85 гр.",/product/grandin-vlazhnyj-korm-dlya-kotyat-tunets-v-nezhnom-zhele-85-gr-760-1055472/,219 ₽,Нет старой цены
1061429,"Ownat Adult Sterilized Grain Free Just Сухой корм беззерновой для стерилизованных кошек, с рыбой, 1 кг",/product/ownat-korm-dlya-sterilizovannyh-koshek-s-ryboj-1-kg-87302-1061429/,1 699 ₽,Нет старой цены
1051181,"INABA CIAO Влажный корм (пауч) для кошек, тунец магуро и тунец кацуо с семгой, 60 гр.",/product/inaba-ciao-vlazhnyj-korm-dlya-koshek-tunets-maguro-i-tunets-katsuo-s-semgoj-60-g-89834-1051181/,159 ₽,Нет старой цены
1053530,"Ownat Adult Care Renal Сухой корм для взрослых кошек с хронической почечной недостаточностью, с курицей, 1,5 кг",/product/ownat-adult-care-renal-suhoj-korm-dlya-vzroslyh-koshek-s-hronicheskoj-pochechnoj-nedostatochnostyu-s-kuritsej-1-5-kg-1192-1053530/,2 179 ₽,Нет старой цены
1051176,"INABA CIAO Влажный корм (пауч) для кошек, тунец магуро и тунец кацуо, 60 гр.",/product/inaba-ciao-vlazhnyj-korm-dlya-koshek-tunets-maguro-i-tunets-katsuo-60-g-89053-1051176/,159 ₽,Нет старой цены
1049422,"Crave Влажный корм (пауч) полнорационный для кошек всех пород старше 1 года, с говядиной, 70 гр.",/product/crave-korm-konservirovannyj-polnoratsionnyj-dlya-koshek-vseh-porod-starshe-1-goda-s-govyadinoj-70-g-90013-1049422/,99 ₽,Нет старой цены
1055468,"Grandin Влажный корм для взрослых кошек, тунец в нежном желе, 85 гр.",/product/grandin-vlazhnyj-korm-dlya-vzroslyh-koshek-tunets-v-nezhnom-zhele-85-gr-89034-1055468/,219 ₽,Нет старой цены
1061064,"Monge Sterilized cat Влажный корм (пауч) для стерилизованных кошек, кефаль и зелёная фасоль, 80 гр.",/product/monge-korm-vlazhnyj-dlya-sterilizovannyh-koshek-kefal-i-zelenaya-fasol-80g-86531-1061064/,209 ₽,Нет старой цены
1061522,"ProPlan Sterilised Renal Plus Сухой корм для стерилизованных кошек, с кроликом, 600 гр.",/product/proplan-korm-suhoj-dlya-sterilizovannyh-koshek-s-krolikom-400-200-g-87396-1061522/,589 ₽,Нет старой цены
1030043,Monge Консервы для кошек тунец с курицей и креветками,/product/monge-konservy-dlya-koshek-tunets-s-kuritsej-i-krevetkami-776-1030043/,283 ₽,Нет старой цены
1055467,"Grandin Влажный корм (пауч) для взрослых кошек, тунец с морским окунем в нежном желе, 85 гр.",/product/grandin-vlazhnyj-korm-dlya-vzroslyh-koshek-tunets-s-morskim-okunem-v-nezhnom-v-zhele-85-gr-89030-1055467/,219 ₽,Нет старой цены
1049812,"Perfect Fit Влажный корм для стерилизованных кошек, паштет с индейкой, 75 г",/product/perfect-fit-vlazhnyj-korm-dlya-sterilizovannyh-koshek-pashtet-s-indejkoj-75-g-581-1049812/,43 ₽,Нет старой цены
1039529,Monge корм для стерилизованных кошек с форелью,/product/monge-korm-dlya-sterilizovannyh-koshek-s-forelyu-1158-1039529/,10 329 ₽,Нет старой цены
1061061,"Monge Kitten Влажный корм (пауч) для котят, тунец, шпинат и мини-морковь, 80 гр.",/product/monge-korm-vlazhnyj-dlya-kotyat-tunets-shpinat-i-mini-morkov-80g-86528-1061061/,209 ₽,Нет старой цены
1030040,Monge Консервы для кошек тихоокеанский тунец с курицей,/product/monge-konservy-dlya-koshek-tihookeanskij-tunets-s-kuritsej-773-1030040/,283 ₽,Нет старой цены
1061059,"Monge Kitten Влажный корм (пауч) для котят, тунец, зелёный горошек и мини-морковь, 80 гр.",/product/monge-korm-vlazhnyj-dlya-kotyat-tunets-zelenyj-goroshek-i-mini-morkov-80g-86526-1061059/,209 ₽,Нет старой цены
1030037,Monge Консервы для кошек атлантический тунец,/product/monge-konservy-dlya-koshek-atlanticheskij-tunets-771-1030037/,283 ₽,Нет старой цены
1051180,"INABA CIAO Влажный корм (пауч) для кошек, куриное филе с говядиной в желе, 60 гр.",/product/inaba-ciao-pauch-dlya-koshek-kurinoe-file-s-govyadinoj-v-zhele-60-g-89055-1051180/,145 ₽,Нет старой цены
1040778,"Royal Canin Gastrointestinal Hairball Сухой корм для кошек, 400 гр.",/product/royal-canin-korm-suhoj-koshek-gastrointestinal-heirbol-kontrol-400-g-3110-1040778/,925 ₽,Нет старой цены
1061060,"Monge Kitten Влажный корм (пауч) для котят, тунец, киноа и мини-морковь, 80 гр.",/product/monge-korm-vlazhnyj-dlya-kotyat-tunets-kinoa-i-mini-morkov-80-g-86527-1061060/,209 ₽,Нет старой цены
1030038,Monge Консервы для кошек морепродукты с курицей,/product/monge-konservy-dlya-koshek-moreprodukty-s-kuritsej-772-1030038/,283 ₽,Нет старой цены
1053570,"Mealfeel Functional Nutrition Sterilized Влажный корм (ламистер) для кошек, с индейкой и морковью, 100 гр.",/product/mealfeel-functional-nutrition-sterilized-vlazhnyj-korm-lamister-dlya-koshek-s-indejkoj-i-morkovyu-100-gr-565-1053570/,68 ₽,79 ₽
1003030,"Purina Veterinary Diets OM St/Ox Obesity Management Сухой диетический корм для снижения избыточной массы тела у кошек, 1,5 кг",/product/purina-veterinary-diets-om-st-ox-obesity-management-suhoj-korm-dlya-vzroslyh-koshek-dlya-snizheniya-izbytochnoj-massy-tela-1-5-kg-3077-1003030/,4 295 ₽,Нет старой цены
1030280,"Prime Ever Delicacy Влажный корм (консервы) для кошек, мусс с цыпленком, тунцом, зеленым чаем и водорослями, 80 гр.",/product/prime-ever-delicacy-konservy-dlya-koshek-muss-s-tsyplenkom-tuntsom-zelenym-chaemi-vodoroslyami-80-g-823-1030280/,259 ₽,Нет старой цены
1061056,"Monge Adult cat Влажный корм (пауч) для взрослых кошек, с брокколи и мини-кукурузой, 80 гр.",/product/monge-korm-vlazhnyj-dlya-koshek-brokkoli-i-mini-kukuruza-80g-86523-1061056/,209 ₽,Нет старой цены
1061520,"ProPlan Delicate Degistion Сухой корм для кошек с чувствительным пищеварением, с индейкой и рисом, 600 гр.",/product/proplan-korm-suhoj-dlya-koshek-s-chuvstvitelnym-pishchevareniem-s-indejkoj-i-risom-400-200-g-87394-1061520/,583 ₽,Нет старой цены
1058746,"Guabi Natural Natural Cat Влажный корм (пауч) беззерновой для взрослых кошек, с курицей, лососем и овощами, 85 гр.",/product/guabi-natural-pauch-bezzernovoj-dlya-vzroslyh-koshek-kuritsa-losos-i-ovoshchi-85g-533-1058746/,78 ₽,129 ₽
1053892,"Farmina OCEAN CAT влажный корм для кошек с тунцом и лососем, 70 г",/product/farmina-ocean-cat-vlazhnyj-korm-dlya-koshek-s-tuntsom-i-lososem-70-g-86919-1053892/,259 ₽,Нет старой цены
1039530,Monge корм для стерилизованных кошек с уткой,/product/monge-korm-dlya-sterilizovannyh-koshek-s-utkoj-1159-1039530/,10 329 ₽,Нет старой цены
1061058,"Monge Adult cat Влажный корм (пауч) для взрослых кошек, с мидиями и оливками, 80 гр.",/product/monge-korm-vlazhnyj-dlya-koshek-midii-i-olivki-80g-86525-1061058/,209 ₽,Нет старой цены
1030042,Monge Консервы для кошек тунец с курицей и говядиной,/product/monge-konservy-dlya-koshek-tunets-s-kuritsej-i-govyadinoj-775-1030042/,283 ₽,Нет старой цены
1061066,"Monge Sterilized Влажный корм (консервы) для стерилизованных кошек, тунец, бурый рис и гинкго билоба, 80 гр.",/product/monge-korm-vlazhnyj-dlya-sterilizovannyh-koshek-tunets-buryj-ris-i-ginkgo-biloba-80g-86533-1061066/,247 ₽,Нет старой цены
1061068,"Monge Sterilized Влажный корм (консервы) для стерилизованных кошек, тунец и кальмар, 80 гр.",/product/monge-korm-vlazhnyj-dlya-sterilizovannyh-koshek-tunets-kalmar-80-g-86535-1061068/,247 ₽,Нет старой цены
1005923,"Brit Care Влажный корм (пауч) для кошек, с тунцом, 80 гр.",/product/brit-care-cat-pouch-vlazhnyj-korm-dlya-koshek-s-tuntsom-80-g-88947-1005923/,165 ₽,Нет старой цены
1059511,"Brit Care Sterilised Сухой корм для стерилизованных кошек, с индейкой, 400 гр.",/product/brit-korm-suhoj-dlya-sterilizovannyh-koshek-s-indejkoj-400g-83138-1059511/,529 ₽,Нет старой цены
1005918,"Brit Fish Dreams Влажный корм (консервы) для кошек, с тунцом и лососем, 80 гр.",/product/brit-fish-dreams-konservy-dlya-koshek-s-tuntsom-i-lososem-80-gr-88951-1005918/,177 ₽,Нет старой цены
1059509,"Brit Care Sensitive Сухой корм для кошек, с индейкой и ягненком, 400 гр.",/product/brit-korm-suhoj-dlya-vzroslyh-koshek-s-indejkoj-i-yagnenkom-400g-83137-1059509/,529 ₽,Нет старой цены
1049440,"Whiskas Влажный корм для кошек, паштет с курицей и индейкой, 75 г",/product/whiskas-vlazhnyj-korm-dlya-koshek-pashtet-s-kuritsej-i-indejkoj-75-g-482-1049440/,27 ₽,33 ₽
1061166,"Мираторг Сухой корм для стерилизованных кошек, c кроликом, 10 кг",/product/miratorg-korm-suhoj-dlya-sterilizovannyh-koshek-c-krolikom-10kg-86618-1061166/,6 230 ₽,8 899 ₽
1061057,"Monge Adult cat Влажный корм (пауч) для взрослых кошек, с зелёным горошком и мини-морковью, 80 гр.",/product/monge-korm-vlazhnyj-dlya-koshek-zelenyj-goroshek-i-mini-morkov-80g-86524-1061057/,209 ₽,Нет старой цены
1006501,"Wellkiss Kitten Влажный корм (пауч) для котят, с ягненком и говядиной в соусе, 100 гр.",/product/wellkiss-kitten-vlazhnyj-korm-pauch-dlya-kotyat-s-yagnenkom-i-govyadinoj-v-souse-100-gr-447-1006501/,68 ₽,Нет старой цены
1060283,"Whiskas Сухой корм для кошек, курица и индейка, 1,9 кг",/product/whiskas-korm-suhoj-dlya-koshek-assorti-podushechki-s-pashtetom-kuritsa-indejka-1-9kg-84712-1060283/,684 ₽,855 ₽
1037871,"Royal Canin Satiety Weight Management сухой диетический корм для взрослых кошек с избыточным весом, 3,5кг",/product/royal-canin-satiety-weight-management-suhoj-dieticheskij-korm-dlya-vzroslyh-koshek-s-izbytochnym-vesom-3-5kg-3108-1037871/,6 307 ₽,Нет старой цены
1004764,"Hill's Prescription Diet i/d Влажный диетический корм (пауч) для кошек при расстройствах пищеварения, жкт, с курицей, 85 гр.",/product/hills-prescription-diet-i-d-vlazhnyj-dieticheskij-korm-dlya-koshek-pri-rasstrojstvah-pishchevareniya-zhkt-s-kuritsej-85-gr-88943-1004764/,185 ₽,Нет старой цены
1005920,"Brit Fish Dreams Влажный корм (консервы) для кошек, с тунцом, морковью и горошком, 80 гр.",/product/brit-fish-dreams-konservy-dlya-koshek-s-tuntsom-morkovyu-i-goroshkom-80-gr-88949-1005920/,177 ₽,Нет старой цены
1049452,"Whiskas Влажный корм (пауч) для кошек, паштет с уткой, 75 гр.",/product/whiskas-vlazhnyj-korm-dlya-koshek-pashtet-s-utkoj-75-g-494-1049452/,27 ₽,33 ₽
1061169,"Мираторг Сухой корм для беременных кошек и котят до 4 месяцев, с куриной грудкой, 10 кг",/product/miratorg-korm-suhoj-dlya-beremennyh-koshek-i-kotyat-do-4-mes-s-kurinoj-grudkoj-10kg-86621-1061169/,5 950 ₽,8 499 ₽
1049442,"Whiskas Влажный корм для кошек, паштет с индейкой и кроликом, 75 г",/product/whiskas-vlazhnyj-korm-dlya-koshek-pashtet-s-indejkoj-i-krolikom-75-g-484-1049442/,27 ₽,33 ₽
1005915,"Brit Care Влажный корм (консервы) для котят, с цыпленком, 80 гр.",/product/brit-care-cat-konservy-dlya-kotyat-s-kuritsej-80-g-88950-1005915/,177 ₽,Нет старой цены
1043129,"Farmina N&D Prime Сухой корм для котят, с курицей и гранатом, 300 гр.",/product/farmina-n-d-prime-suhoj-korm-dlya-kotyat-s-kuritsej-i-granatom-1193-1043129/,1 023 ₽,Нет старой цены
